user,star,sumary,country&time,kind item,image,comment
Jake Fleischer,5,Amazing Stuff,"Reviewed in the United States on February 10, 2024",Color: Classic BlackVerified Purchase,0,This mouse can be dragged through hell and back and still work. I have beaten this mouse more than my wife and it still operates like it's brand new. The scroll wheel kinda broke after a year in service but for the price I will take that. Get this mouse NOW if you were on the fence about it.
Ashton Cooper,5,"""Essential"" is the right word!","Reviewed in the United States on February 25, 2024",Color: Classic BlackVerified Purchase,0,"There are a lot of different gaming mice out there but a lot of gaming mice on the market in my opinion kind of just over do it. They are just way to expensive or have to many unneeded features (like 12+ buttons, covered in rainbow RGB lighting, wireless or have a super weird shape/feel)

I just need a simple gaming mouse…

I was at tech-school for my training in the Air force (I know, weirdest place out of anywhere) and I had my gaming laptop mailed to me so on my days off, I could play games with my sister & friends. For a long time I used a basic Dell computer-lab work mouse, and it gets the job done but I thought maybe it was time for a fun upgrade. There was a GameStop at a mall and there I bought a white colored Razer DeathAdder Essential Gaming Mouse. I'm going to tell you now… I immediately LOVED it! Perfect balance of a gaming mouse with some cool features but not overdoing it. Exactly as it says in the name… it's the basic essentials for a gaming mouse! And for the price of $30? Not bad at all.

The size, shape and feel is really good. not overdoing it in my opinion, giving a great ergonomic feeling when in use. The two extra side buttons are great and not overbearing (like with some mice and their 6+ extra buttons all over the mouse) two, in my opinion, are just enough. Lastly the fact that it's wired is nice, helps with price & simplicity. It has some RGB lighting but not all over the place or crazy so no complaints for that.

I rebought one but in the color black so it better matches my laptop and gave my sister the white colored one. Had the white one for almost a year and had ZERO issues or problems with it. If you want a simple, nice and cool gaming mouse that is just the ESSENTIALS this is for you!!!!"
Elhan Martinovic,5,Great buy!,"Reviewed in the United States on January 28, 2024",Color: Mercury WhiteVerified Purchase,0,"The Razer gaming mouse is a true gem for avid gamers. Its ergonomic design ensures comfort during long gaming sessions, and the customizable RGB lighting adds a touch of personalization to the setup. The precision and responsiveness of the mouse are outstanding, providing a competitive edge in gaming scenarios.

The programmable buttons offer versatility, allowing users to tailor the mouse to their gaming preferences. The build quality is robust, with durable materials that withstand the rigors of intense gaming. The smooth glide and accurate sensor contribute to a seamless gaming experience.

Razer's commitment to quality is evident in the attention to detail, from the tactile feel of the buttons to the reliable performance of the scroll wheel. The software integration enhances the overall user experience, enabling fine-tuning of settings.

For gamers seeking a top-tier gaming mouse that combines style, functionality, and performance, the Razer gaming mouse stands out as a 5-star choice that delivers on all fronts."
Alvin Jacobs,5,The Perfect Gaming Mouse with Exceptional Performance,"Reviewed in the United States on June 16, 2023",Color: Mercury WhiteVerified Purchase,0,"The Razer DeathAdder Essential Gaming Mouse in Mercury White has truly won me over with its outstanding performance and sleek design. As an avid gamer, I was looking for a reliable and feature-packed mouse, and this one ticks all the right boxes.

Let's start with the build quality. The DeathAdder Essential boasts a robust construction that feels comfortable and durable in hand. The rubber side grips provide excellent control and prevent any slippage during intense gaming sessions. The mercury white finish adds a touch of elegance to my gaming setup, making it a visually pleasing addition.

The heart of this mouse lies in its 6400 DPI optical sensor. The accuracy and precision it offers are exceptional, ensuring smooth and responsive tracking. Whether I'm engaged in fast-paced FPS battles or performing precise movements in strategy games, the sensor performs flawlessly, delivering the utmost accuracy and minimal cursor jitter.

The five programmable buttons on the DeathAdder Essential are a gamer's dream come true. The customization options available through Razer Synapse software allow me to personalize the mouse according to my gaming preferences. I can assign macros, remap buttons, and create profiles for different games, giving me an edge over my opponents.

One standout feature of this mouse is the integration of mechanical switches. The satisfying clicky feedback they provide adds a tactile element to my gameplay. The switches are incredibly responsive and offer a satisfying tactile feel with each press. Combined with the smooth scroll wheel, the overall responsiveness and precision make gaming an absolute joy.

The software support from Razer is top-notch. The Razer Synapse software is user-friendly and offers a wide range of customization options. I can fine-tune the DPI settings, adjust the lighting effects, and even calibrate the mouse to different surfaces. The software also allows me to sync my mouse settings with other Razer devices, creating a cohesive gaming experience.

In terms of value for money, the DeathAdder Essential exceeds expectations. Considering its competitive price point, it offers a remarkable set of features and performance that easily rivals more expensive gaming mice on the market.

Overall, the Razer DeathAdder Essential Gaming Mouse in Mercury White is a stellar choice for gamers seeking a reliable, high-performance mouse. With its ergonomic design, customizable buttons, accurate optical sensor, and mechanical switches, it elevates my gaming experience to new heights. Razer has once again proven why they are a leader in gaming peripherals, and I have no hesitation in giving this mouse a well-deserved five-star rating."
Mike Eckman,5,Great Mouse for Basic Use,"Reviewed in the United States on February 7, 2024",Color: Classic BlackVerified Purchase,0,"I disagree that this mouse is considered a gaming mouse. Other than the fancy logo and color changing LEDs, there is not much about this mouse that caters it for gaming. I use gaming mice and prefer ones with more than just two side buttons, and a much heavier weight. This is a lightweight mouse which is fine for office work where you're in front of a computer 8 hours a day, but I would much prefer something different for gaming.

But as a general use office mouse, it works great. It is ergonomic enough to be used right or left handed, the scroll wheel works fine, and the buttons press with a reassuring CLICK. For the price, use this in your office, but if you want to get into a Call of Duty or Fortnight tournament, definitely get something else."
Gabriel C.,5,Elevate Your Gaming Experience with the Razer DeathAdder Essential,"Reviewed in the United States on January 18, 2024",Color: Classic BlackVerified Purchase,0,"My gaming journey reached new heights with the Razer DeathAdder Essential Gaming Mouse, a truly essential companion for any gaming enthusiast.

**Pros:**
1. *High-Precision Sensor:* The 6,400 DPI optical sensor is a game-changer. The on-the-fly sensitivity adjustment ensures seamless transitions between different gaming scenarios, providing the precision needed for both intense gaming sessions and creative work.
2. *Durable Mechanical Switches:* The promise of up to 10 million clicks is not just a number; it's a testament to the mouse's longevity. The mechanical switches, coupled with a reassuring 2-year warranty, instill confidence in the product's durability.
3. *Ridged, Rubberized Scroll Wheel:* The small, tactile bumps on the scroll wheel are a stroke of genius. They enhance grip and allow for precise and controlled scrolling, especially crucial in high-stakes gaming situations where every move matters.
4. *Programmable Buttons:* The flexibility of 5 programmable buttons opens up a world of possibilities. With Razer Synapse, customization knows no bounds, enabling users to remap buttons and assign complex macros effortlessly.

**Conclusion:**
In conclusion, the Razer DeathAdder Essential Gaming Mouse lives up to its name, providing an essential tool for gamers seeking precision, durability, and customization. Razer's commitment to quality is evident in every aspect, from the high-precision sensor to the durable mechanical switches. Elevate your gaming experience with this reliable and feature-rich gaming mouse—it's a game-changer in every sense."
Tiff,5,Borrowed one and fell in love,"Reviewed in the United States on February 25, 2024",Color: Classic BlackVerified Purchase,0,"My mouse broke after years of hard use. In a pinch I borrowed this mouse from my daughter who uses it for gaming. In one sitting, I fell in love with a mouse in a way I didn't know was possible. It's quick, smooth, and fits beautifully in the hand. I immediately ordered my own. I wanted a corded version, but I think you can get it Bluetooth if you prefer. So happy."
Fuzzyball,5,"Nice mouse, no cheese needed","Reviewed in the United States on March 3, 2024",Color: Classic BlackVerified Purchase,0,"Ok, forget the cheesy remark. Bought corsair mouse last august, did not like (resolution shaky? Buttons very sensitive with short throw). This mouse is much better. Seems more solid, too, but time will tell. I have a crappy setup for gaming so i need all the help I can get. This works."
emily,5,Love,"Reviewed in the United States on March 2, 2024",Color: Classic BlackVerified Purchase,0,"Got as a gift for my sister but when I set it up for her I was a bit jealous and went and got myself one. That was her birthday almost two years ago, they're both still in regular use."
Maxbeard,5,Low priced reasonable gaming mouse,"Reviewed in the United States on March 11, 2024",Color: Classic BlackVerified Purchase,0,I replaced my Logitech wireless mouse with it. Seems like its about 150% more accurate than a standard office mouse.
Charles Christopher,5,Comfortable,"Reviewed in the United States on March 5, 2024",Color: Classic BlackVerified Purchase,0,Feels good in the hand and highly responsive. I recommend you download the Razer software and increase the DPI because the default DPI out of the box is too low.
Ivy,5,Best mouse,"Reviewed in the United States on March 12, 2024",Color: Classic BlackVerified Purchase,0,It had the best connection and it had good RGB and it worked very well
Chris Materne,5,Amazing product,"Reviewed in the United States on March 2, 2024",Color: Classic BlackVerified Purchase,0,"I love this mouse, I’ve been switching from controller to keyboard and mouse and it’s been one of the best gaming experiences I’ve had ever, highly recommend."
Paul E. Fisher,5,Nice essential mouse for gaming,"Reviewed in the United States on February 3, 2024",Color: Classic BlackVerified Purchase,0,"Sure you can pay a lot of money for gaming mouses. But Razer Deathadder Essential does enough without being too overwhelming. It has two buttons for your thumb and a very quick reaction to your movement. The scroll wheel is clickable and freely moves with many stops to keep it in exact positions.
I bought this when my wireless Deathadder became a little glitchy and found the Deathadder Essential as a perfect replacement. For a gaming mouse under $25, I cannot recommend it more!"
jesi,5,Smooth!,"Reviewed in the United States on March 9, 2024",Color: Mercury WhiteVerified Purchase,0,Glides so nice and is easy on the wrist!
Adrian Dennis,5,Excellent product,"Reviewed in the United States on March 10, 2024",Color: Classic BlackVerified Purchase,0,"Just as my son wanted it, original"
Rosy,5,"Guy friend recommended me this, he was right.","Reviewed in the United States on February 20, 2024",Color: Mercury WhiteVerified Purchase,0,This is ana amazing mouse to have when gaming. I need to get used to it since I don’t use the side buttons but other than that it’s an amazing piece of tech to have and worth the money!
Ann,5,"Pretty, simple, and great quality!","Reviewed in the United States on January 10, 2024",Color: Mercury WhiteVerified Purchase,1,"I own this mouse in both colors now and use it everyday for both gaming and schoolwork. After using my black one for about 1 1/2 years, I can say I've had no issues. The light up detail on the mouse is pretty and matches my new setup- it's white on the white mouse and green on the black mouse.

The two side buttons are useful as key binds in many games and to go back and forth with webpages and I'm happy there isn't a DPI button near the scroll wheel- no accidental DPI changes. The mouse also has a slightly matte texture on the top which makes using it enjoyable. Not a very heavy mouse, is a good size for an average length hand."
Rodney,5,Great gaming mouse,"Reviewed in the United States on March 5, 2024",Color: Mercury WhiteVerified Purchase,0,I like the mouse. It is very smooth and feels great when I play.
Helen M Hennigan,5,Great mouse for the price,"Reviewed in the United States on March 6, 2024",Color: Classic BlackVerified Purchase,0,I got it for my brother for Christmas. He loves it
Andrew Gower,5,Love this model mouse keep remaking it,"Reviewed in the United States on January 25, 2024",Color: Classic BlackVerified Purchase,0,"I bought this because my old death adder would some time have periods of time for double clicks.

Been using this mouse for probably over 6 months before writing this review and it working great.

I think this is the same model but they make new ones of it in recent time, maybe adding in slight improvements the innovated over time.

Mouse working great and I enjoy the use of it.

Bigger hands might like this mouse"
rayzo,5,AMAZING for the price.,"Reviewed in the United States on February 25, 2024",Color: Classic BlackVerified Purchase,0,"I cant say much except for how its so good. I use it for fortnite, valorant, the finals, etc. and it is amazing!"
DO NOT BUY,5,Good mouse,"Reviewed in the United States on February 25, 2024",Color: Classic BlackVerified Purchase,0,"Works fine haven’t had any problems yet, just a bit small and a little light but other than that it’s great"
Austin Whited,5,clean product,"Reviewed in the United States on February 28, 2024",Color: Mercury WhiteVerified Purchase,1,"lee is bright, great glide, nice clicks. overall solid product for what you're purchasing."
Norman Matthews,5,Great mouse for the price.,"Reviewed in the United States on January 26, 2024",Color: Classic BlackVerified Purchase,0,"I like this mouse. It works as it should. It has a nice feel. Coming from a Red Dragon Griffin that started having issues I found the DeathAdder to be a better mouse overall. It's more responsive. My only issue with the mouse is that coming from the Griffin this mouse is a good bit smaller. I am a big guy (6'4"") with big hands and I find the DeathAdder to be a bit small for my hands."
Chupacabra,5,Gaming mouse,"Reviewed in the United States on February 26, 2024",Color: Classic BlackVerified Purchase,0,Great product. Razor has really good products. My son loves the 5 programmable settings. Highly recommend.
087Alfred,5,Feels good,"Reviewed in the United States on February 26, 2024",Color: Mercury WhiteVerified Purchase,0,Nice replacement for when my deathadder bit the dust after 8 years
Funciona increíble,5,El ratón no es inalámbrico,"Reviewed in the United States on March 6, 2024",Color: Classic BlackVerified Purchase,0,.
Ev,5,Great starter mouse,"Reviewed in the United States on March 4, 2024",Color: Classic BlackVerified Purchase,0,Goated brand
Jonathan,5,Really nice!!!!,"Reviewed in the United States on February 25, 2024",Color: Classic BlackVerified Purchase,0,It flows great!
Gabriela paz,5,My son like it. All good,"Reviewed in the United States on February 24, 2024",Color: Mercury WhiteVerified Purchase,0,All good look nice work well.
Gary hempel,5,Got as a spare.,"Reviewed in the United States on January 31, 2024",Color: Classic BlackVerified Purchase,0,"Still in the box, HOWEVER I have used these before and they are great. There are other gaming mice that have more featured these days but I don't need that I just need a good durable mouse and these are awesome."
tyler warren,5,Good quality,"Reviewed in the United States on February 20, 2024",Color: Classic BlackVerified Purchase,0,Second purchase of this mouse and it’s great quality.
ida moreno,5,Just a mouse,"Reviewed in the United States on February 27, 2024",Color: Mercury WhiteVerified Purchase,0,Works as intended
Dustin,5,A Classic in the Gaming World!,"Reviewed in the United States on October 14, 2023",Color: Classic BlackVerified Purchase,0,"Rating: ⭐⭐⭐⭐⭐

The Razer DeathAdder Essential Gaming Mouse is a timeless classic in the gaming world, offering a perfect blend of essential features and high-quality performance.

Pros:

1. Optical Sensor: The 6400 DPI optical sensor provides precise tracking and responsiveness, making it ideal for a wide range of gaming genres. You can fine-tune it to your preference.
2. Mechanical Switches: The mechanical switches offer a satisfying click and fast response, ensuring you don’t miss a beat during intense gaming sessions.
3. Programmable Buttons: With five programmable buttons, you have the flexibility to customize your gaming experience. Set up macros and shortcuts to gain a competitive edge.
4. Rubber Side Grips: The rubber side grips are comfortable and provide a secure hold on the mouse, even during the longest gaming marathons.
5. Classic Design: The classic black design is sleek and timeless. It doesn’t draw unnecessary attention but still looks great on any gaming desk.
6. Razer Quality: Razer’s reputation for quality and durability holds true with the DeathAdder Essential. It’s built to withstand heavy use and is reliable over the long term.

Cons:

1. Limited Buttons: While the five programmable buttons are sufficient for most gamers, those who prefer more complex MMOs might find the button count limiting.

In summary, the Razer DeathAdder Essential Gaming Mouse is a gaming icon for a reason. It offers everything a gamer needs – precision, speed, comfort, and durability. Whether you’re a casual gamer or a dedicated enthusiast, this mouse is a fantastic choice, and its classic design ensures it won’t go out of style anytime soon. Highly recommended!"
Amy Brown,5,Came on time,"Reviewed in the United States on February 22, 2024",Color: Classic BlackVerified Purchase,0,Was just what we ordered
chase klotter,5,Great Mouse!,"Reviewed in the United States on January 30, 2024",Color: Mercury WhiteVerified Purchase,0,"I love this mouse as an 'entry' level gaming mouse. Works well, nothing too fancy but the 2 LEDs are nice. DPI is customizable, and I wouldn't consider the software 'bloatware'. 5/5"
Tim Lovezzola,5,Very good mouse for price!,"Reviewed in the United States on February 16, 2024",Color: Mercury WhiteVerified Purchase,1,This mouse is a clean and cheap alternative gaming mouse
Ash,5,Had for a while now,"Reviewed in the United States on February 11, 2024",Color: Mercury WhiteVerified Purchase,0,"Had for a while, no issues. Great mouse, even better price."
Leos,5,Best Mouse In General,"Reviewed in the United States on February 5, 2024",Color: Mercury WhiteVerified Purchase,0,"For the price I paid its a pretty good mouse, except for the fact I got sent the black one not the white one I ordered."
Kathryn,5,Love it,"Reviewed in the United States on February 9, 2024",Color: Mercury WhiteVerified Purchase,0,Great mouse. If you are thinking of buying it do it. It works great and looks nice.
St krantz,5,Works as expected. Red Skull didn't like us for hooking it up while was gone.HAIL HYDRA.!!,"Reviewed in the United States on January 3, 2024",Color: Classic BlackVerified Purchase,0,"This is what I've been begging for --- a mouse!!! Not the little white guy who eats cheese. No, I wanted a computer mouse and always put it at the top of my list for Santa. I said I didn't an ordinary one -- I want the best. Then I got this mouse and I was in heaven for a day or two. My best friend showed an advtersement for a cool computer video camera. I know that what for next Christmas."
JODIEANN JONES,5,Fast,"Reviewed in the United States on February 13, 2024",Color: Classic BlackVerified Purchase,0,"Moves fast, lightweight up and fun to use."
Christopher C.,5,Awesome for the price!,"Reviewed in the United States on January 25, 2024",Color: Classic BlackVerified Purchase,0,The brand speaks for itself. is the 2nd mouse I have purchased from the same manufacturer and I am very impressed with the quality. Highly recommend. Cannot beat for the price.
Cristofer suchite,5,Amazing product!!!,"Reviewed in the United States on January 17, 2024",Color: Mercury WhiteVerified Purchase,1,"I've been using this Razer mouse for about 6 months now, and honestly, it's been fantastic for the price. It's reliable, no issues at all, and the performance is top-notch! Highly recommend it if you're on the lookout for a solid gaming mouse and not breaking the bag"
Amazon Customer,5,Like,"Reviewed in the United States on February 16, 2024",Color: Classic BlackVerified Purchase,0,👍
Works great,5,Perfect,"Reviewed in the United States on February 19, 2024",Color: Classic BlackVerified Purchase,0,Great
Angela Johnson,5,Programmable buttons,"Reviewed in the United States on January 13, 2024",Color: Classic BlackVerified Purchase,0,I love this mouse because it has programmable buttons that you can change to anything on your keyboard. When you first plug in your mouse it automatically downloads the app where you can change the buttons on the side of your mouse. I would recommend this mouse to anyone looking for a relatively cheap quality starter mouse.
Saul Goodman,5,Quality - great value!,"Reviewed in the United States on January 27, 2024",Color: Classic BlackVerified Purchase,0,This is a great mouse at a good price. The direct cord gives me an excellent connection for gaming. Good delivery. Razor is a quality brand.
Felix Mischler,5,Good Used,"Reviewed in the United States on January 23, 2024",Color: Classic BlackVerified Purchase,0,"Got it used and the only issue was the box was ripped, i was expecting no box at all lol. For used the mouse is in perfect condition!"
Es muy lindo y se siente de buena calidad al parecer tener la base de aluminio,5,GREAT QUALITY,"Reviewed in the United States on February 9, 2024",Color: Classic BlackVerified Purchase,0,A great buy for the price
Brandon S,5,this mouse will change your life,"Reviewed in the United States on February 5, 2024",Color: Classic BlackVerified Purchase,0,it is so comfortable to hold and has great tracking and buttons
Vance,5,Perfect mouse,"Reviewed in the United States on November 29, 2023",Color: Mercury WhiteVerified Purchase,0,"Recently got my hands on this sleek white mouse for my setup, and it's quickly become a standout addition. Visually, it seamlessly fits into my all-white gear, bringing an upgraded aesthetic.

Functionality-wise, it's a game-changer. The clicks are perfectly balanced—neither too loud nor too soft. What sets it apart, though, is the ergonomic design. It feels tailor-made for my hand, ensuring a comfortable experience even during extended work sessions. No more hand strain or awkward grips.

The mouse's movements are impressively smooth, offering precise control like a well-choreographed dance across the screen. It's more than just a tool; it's a functional and stylish companion to my daily tasks.

If you're in the market for a mouse that not only complements your setup visually but also excels in performance and comfort, this one's a solid choice. My workspace has levelled up, and the daily grind feels a whole lot better with this reliable companion. 👍"
Mister Steele,5,feels good,"Reviewed in the United States on January 28, 2024",Color: Mercury WhiteVerified Purchase,0,This product fits my hand well and has a decent sensitivity that doesn't need adjusting.
Vay Lester,5,No super,"Reviewed in the United States on February 4, 2024",Color: Mercury WhiteVerified Purchase,1,The gaming mouse is big and not very comfortable
rainydays,5,good mouse,"Reviewed in the United States on January 6, 2024",Color: Classic BlackVerified Purchase,0,it's a nice mouse but the clicks might be too loud. It's quite clicky. The software works and you can customize lighting. It kind of improved my fps gaming skills in some way idk. The bad thing about it is just it's just a bit loud.
Jon,5,My new favorite mouse!,"Reviewed in the United States on January 1, 2024",Color: Mercury WhiteVerified Purchase,0,"My old mouse wasnt registering when I would click so obviously it was at the end of its life.

I decided to get this mouse due to the good reviews and also because its a pretty simple design done really well. This is by far the best mouse I have ever used for casual computer stuff plus gaming.

Great price point, great quality! 5/5"
bootybandit,5,very nice,"Reviewed in the United States on January 26, 2024",Color: Mercury WhiteVerified Purchase,0,i used the mouse on my ps4 and ps5 which is very compatible
