user,star,sumary,country&time,kind item,image,comment
Isaac,4,8/10,"Reviewed in the United States on January 13, 2024",Color: Mercury WhiteVerified Purchase,0,Great mouse for the price all tho it’s a bit bulky it’s also has a lil bit of weight to it so if your looking for a super light mouse just get a honeycomb mouse.
Aaron,4,Good if you don't want to scroll,"Reviewed in the United States on December 22, 2023",Color: Classic BlackVerified Purchase,0,"I'm a fan of the old Microsoft intellimouse for gaming and everyday use. I couldn't find one of those for under $50, so I gave this one a shot. It's a good mouse, but the scroll wheel barely lasted a year. Now I scroll down and it goes down a couple of lines, then back halfway up the page. Other than that it has been fine."
Tyler Cox,4,Green RGB only,"Reviewed in the United States on December 30, 2023",Color: Classic BlackVerified Purchase,0,"This might be funny to some but it actually is a dealbreaker for me, I gotta have my blue lights... well built, feels like a great mouse, but I will be returning for a different model."
Stanky Stank Simmonies,4,"This mouse is great, however it's very loud","Reviewed in the United States on January 2, 2024",Color: Classic BlackVerified Purchase,0,"The mouse functions perfectly, no complaints at all

However this mouse clicks very loud, and it's not a red switch mechanical keyboard loud. It's a cheap plastic clicking loud

But other than that this mouse is great"
The Travel Sports Life,4,Need a great gaming mouse?,"Reviewed in the United States on December 27, 2023",Color: Mercury WhiteVerified Purchase,0,I just got back into gaming recently. I lost my old mouse and needed a replacement. One of my friends has this one. It is working good so far.
Amazon Richard,4,First usage of 'better' mouse,"Reviewed in the United States on February 24, 2023",Color: Classic BlackVerified Purchase,0,"I wanted to title this ""First usage of a high-end mouse"", but at this price, it isn't really high-end, but it is a step up from the cheaper mice, and I wanted to see what it was like.

I am impressed (mostly).

It is a heavier mouse, but that makes it feel more solid, and I like that a lot. I also really, really noticed the very smooth gliding of the mouse, and like this a lot.

I don't do head-to-head gaming; most of my games are solo playing. I don't really see much of a difference with this mouse over the old mice.

I'm really used to 3-button mouse, so I really don't know what to use the two extra mouse buttons for (they are on the left side of the mouse, and they won't be accidentally clicked as long as the grip stays in the lower area. I looked up some suggestions, but I was a bit disappointed that some key combinations don't work (I was hoping to map ctrl+windows+left to one button and ctrl+windows+right to the other, but it doesn't seem to realize when I press the windows button).

That brings us to the software.. you have to install it to adjust the lights or assign the buttons. The EULA basically says that they collect data on usage. I did want the lights to turn off after a time, and I like the ""breathing"" light... so, for now, I'm running it (the effects don't stick when you don't run the program). I don't trust the software that comes with the mouse. There may be some other way to control it.

Aside from the software, I'm impressed by my foray into fancier mice.

UPDATE:

It's been less than a year, and it has worked pretty well. However, as others have noted, the mouse wheel is beginning to give me difficulties. If it gets worse, I will need to replace the mouse, and I won't be buying this brand again."
Guillermo Rodriguez,4,4 stars,"Reviewed in the United States on December 31, 2023",Color: Classic BlackVerified Purchase,0,"Easily configurable using the razer software, it's a bit big if you have small hands as is my case"
Yiming zou,4,Don’t send the wrong address,"Reviewed in the United States on November 19, 2023",Color: Mercury WhiteVerified Purchase,0,The item is good! But please the driver look clearly the address my address was Apt B. Thank you! If you put the items not at the right place I can not find the item. I was lost a few item before!!!
Aiden o,4,Very good mouse,"Reviewed in the United States on December 11, 2023",Color: Mercury WhiteVerified Purchase,1,You can drag click and the mouse is comfortable for big hands
Tamari A.,4,so far so good,"Reviewed in the United States on October 30, 2023",Color: Classic BlackVerified Purchase,0,"after a while of playing with this mouse it's been good,
but also after reading the reviews, it's pretty common to see people complain about it breaking after some time so im kind of afraid of that, now i just pray that it doesnt screw up.
but overall it's a good mouse"
Pauly P,4,A GREAT Budget Mouse for Gaming,"Reviewed in the United States on May 2, 2023",Color: Mercury WhiteVerified Purchase,0,"I recently purchased this gaming mouse and have been very impressed with its performance. The 6400 DPI optical sensor is highly accurate and responsive, allowing for smooth and precise movements during gameplay. The mouse is also highly customizable, with five programmable buttons that can be tailored to fit your specific gaming needs.

One of the standout features of the DeathAdder Essential is its ergonomic design. The shape of the mouse is specifically designed to fit comfortably in the hand, reducing strain and fatigue during extended gaming sessions. The textured side grips are also a nice touch, providing additional traction and control.

The build quality of the DeathAdder Essential is excellent, with a sturdy construction that feels durable and long-lasting. The braided cable is also a nice touch, adding to the overall premium feel of the product.

Overall, I highly recommend the Razer DeathAdder Essential Gaming Mouse for anyone looking for a high-quality, responsive, and customizable gaming mouse. Its ergonomic design, accurate sensor, and programmable buttons make it an excellent choice for gamers of all skill levels."
Chris Cline,4,Quick delivery,"Reviewed in the United States on December 16, 2023",Color: Mercury WhiteVerified Purchase,0,This book is very cute.
Amazon Customer,4,"Feels great, but it broke","Reviewed in the United States on December 11, 2023",Color: Mercury WhiteVerified Purchase,0,Feels durable but actually isn't?
Chris,4,Kid loves it,"Reviewed in the United States on December 1, 2023",Color: Classic BlackVerified Purchase,0,"My kid loves this mouse, uses it so much wanted the same one again"
Axel Yamil,4,Good,"Reviewed in the United States on November 29, 2023",Color: Mercury WhiteVerified Purchase,0,Feels good and yeah it’s good mouse
Amazon Customer,4,Did not have rubber sides. Good budget mouse,"Reviewed in the United States on May 20, 2023",Color: Mercury WhiteVerified Purchase,0,"My razer naga (2014 model) cable frayed recently so I decided to get this mouse while I wait for the new usb lead part to arrive. The mouse is the deathadder essential but the cable is rubber instead of braided and the sides are textured plastic instead of rubber. I'm fine with that but the images are not correct and it would be nice to fix that.
As for the mouse it's a good shape and works well but I find that it's not as nice feeling as the other razor products. My Big complaint is the sides are slippery since its just plastic but grip tape could help. I'm also not a fan of the deep arch in the left side but that's personal preference.
Overall conclusion: it'll work if you are tight on money but If you are willing to spend a little bit more I think the deathadder v2 would be a better buy."
Sonia,4,Center scroll delay,"Reviewed in the United States on November 11, 2023",Color: Classic BlackVerified Purchase,0,Really comfortable and great mouse otherwise if you know how to steady stream page scrolling.
Ian,4,"Overall pretty good, except the scroll wheel.","Reviewed in the United States on June 22, 2023",Color: Mercury WhiteVerified Purchase,0,"Like many other reviews, there seems to be a probably with the scroll wheel. After about 2 weeks of use the scroll wheel went up even after scrolling down. This is a major problem for me, but it might not be for others. When I play games (mainly shooters) I use the scroll wheel to switch between weapons. When I'm out of ammo and I switch my gun it'll just end up switching to secondary then back to the main weapon, which has no ammo in it which to no surprise ends up getting me killed. Other than that excellent mouse, it's lightweight and feels good in the hand. Would recommend that you use the scroll wheel sparingly."
Paul,4,It's good but not great,"Reviewed in the United States on July 18, 2023",Color: Classic BlackVerified Purchase,0,"I just bought this to replace my older DeathAdder from 2013. They both have a 6400 dpi sensor but this newer one feels a little cheaper. For example, it feels slightly lighter in weight and the buttons are a little louder and ""clackety"" sounding. Also, the cord is no longer braided, so it's now just a cheap plasticized cord with lots of kinks in it from being wrapped up in the packaging. I'm sure it will work fine but I may decide to upgrade to a better model."
LJ,4,"Good, but wouldn't buy again.","Reviewed in the United States on September 30, 2023",Color: Mercury WhiteVerified Purchase,0,"Good mouse, responsive.
Wish the symbol wasn't illuminated.
Side buttons are too large, often clicked accidentally."
Amazon Customer,4,good general purpose mouse,"Reviewed in the United States on September 30, 2023",Color: Classic BlackVerified Purchase,0,"deathadders have been good mice for a long time now, i just wish i could change the led color on this one from green to something else"
Jeremy W.,4,Good for the price.,"Reviewed in the United States on July 25, 2023",Color: Mercury WhiteVerified Purchase,0,"Pros:
-Good Ergonomics for those wanting a basic mouse for gaming or general use.
-Simple design for those who aren't looking for something with extreme customization.

Cons:
-The wire is a bit fragile-looking and might be a weak point in the design through years of use.

Pro/Con ?:
-It is not a pro-gamer mouse. It is functional, responsive, but lacks any dpi adjustment or extra features. Might be what you are looking for and I actually enjoy the more minimalistic layout."
rob rusche,4,Good for the money,"Reviewed in the United States on September 4, 2023",Color: Classic BlackVerified Purchase,0,"Good mouse, but it was slipping out of my hands as I lifted it. I put a grip pad on each side and now its great! The grips should have been installed from the factory."
Marco Oseguera,4,Its clean and it is a good quality cheap mouse.,"Reviewed in the United States on September 10, 2023",Color: Mercury WhiteVerified Purchase,0,The mouse is well made and comes in a good packaging the cord is nice and long and the mouse has satisfying click i recommend it for anyone who thinks of getting it
kendra Meyer Rice,4,Pretty Good,"Reviewed in the United States on October 1, 2023",Color: Classic BlackVerified Purchase,0,Doesn't drag click well
Anyone,4,Flexibility,"Reviewed in the United States on August 15, 2023",Color: Classic BlackVerified Purchase,0,While you can’t change the color I enjoy being able to change brightness and dpi settings in the software. It’s a good mouse lighter than expected but slick and a good size.
Lance,4,Does the job,"Reviewed in the United States on September 20, 2023",Color: Classic BlackVerified Purchase,0,great mouse for gaming. Razer Central software could use some fixes but that is a different story.
JMMorton,4,A nice mouse for the money,"Reviewed in the United States on June 10, 2023",Color: Classic BlackVerified Purchase,0,"For full disclaimer, I don't use this for gaming. I work on a computer all day and wanted a 4th mouse button. I used to have a death adder years ago in my gaming days and remember it holding up really well.

I've been using this mouse for months now. It's mostly comfortable. It's got a slightly strange shape that isn't 100% comfortable in my hand. But the 4th button works great, the wheel is nice, and it slides smooth. For the money it's a really tough mouse to beat."
Rocky,4,Decent but scroll wheel issues,"Reviewed in the United States on July 4, 2023",Color: Classic BlackVerified Purchase,0,Decent mouse. The main issue is that the scroll wheel doesn't always respond the way it should. Sometimes it will scroll down when trying to scroll up. Very aggravating. After researching the issue on the Internet I have found that if you blow into the side of the scroll wheel it usually fixes the issue for a while. Not something you should have to do for a manufacturer of this 'caliber'.
Stephanie,4,No Thrills Mouse,"Reviewed in the United States on June 3, 2023",Color: Mercury WhiteVerified Purchase,0,"It's a USB mouse with 2 extra buttons on the side (yes, I know it says 5 but that includes scroll wheel, left and right clicks). There's nothing really special about the product and it works fine. The clicking is loud on the mouse and the side buttons are as well. The white light on the mouse is really bright, but the intensity can be changed in the Synapse software. I wouldn't purchase it for gaming as there's very little control and extras on this mouse."
Lawrence Webley,4,"Great mouse, but the mouse wheel squeaks!","Reviewed in the United States on May 10, 2023",Color: Classic BlackVerified Purchase,0,"This is a great mouse all round, and as such I've owned a couple over the years. I recently bought 2 more (one for work and one to replace my aging home mouse) and while they both work great, both of them have a squeaky mouse wheel from day one. It's not a big deal if you're gaming, but if you scroll a long document or web page it can get pretty irritating pretty quickly. I'm planning to oil it with something to get it to shut up..."
Arthur T.,4,It's good but the mousewheel requires frequent cleaning,"Reviewed in the United States on June 21, 2023",Color: Classic BlackVerified Purchase,0,"I like everything about this mouse except that the mousewheel develops a jitter when it gets dirty, which happens at pretty frequent intervals (a couple of weeks). Wiping the mousewheel with a liberal amount of lens cleaner eventually fixes it, but it is a repeating cycle. I have never had this issue show up with any ""L"" brand mouse after years of nonstop use."
Evan Herrera,4,Stress free mouse,"Reviewed in the United States on June 11, 2023",Color: Classic BlackVerified Purchase,0,"This mouse in particular is a little small for my hands, I’m not a really big guy but my fingers are long as heck and this mouse just barely does the job I need it to, obviously if I’m grinding a game my hand is going to give out after 5-6 hours. I really do wish I could find a mouse that fits my fingers more than my hands"
Alex,4,Mouse wheel broke after 3 months,"Reviewed in the United States on June 16, 2023",Color: Classic BlackVerified Purchase,0,"Well, I bought this mouse in February, and about a month ago the scroll wheel started getting wonky. As of today it's completely unreliable. Scrolling down shudders the screen up and down. I've been using the button built into the wheel (M3?) and then just hovering down to scroll. It's frustrating enough I'm about to buy another mouse. Otherwise it's a sleek design, nice to use for PC gaming. No issues with any other buttons."
S.R,4,It's a razer mouse,"Reviewed in the United States on August 20, 2023",Color: Classic BlackVerified Purchase,0,"It's a razer mouse, what can I say? It works perfectly fine, and with a price you can't argue with, it's a great affordable gaming mouse."
stillo,4,"Comfy mouse, but scroll press is weird","Reviewed in the United States on March 29, 2023",Color: Mercury WhiteVerified Purchase,1,"I don’t mind this mouse, I had a razor one before and it hasn’t done me wrong. The only complaint I have is that when I use scroll up and down (I use a lot in gaming) it mistakes it as scroll press way too easily, my old mouse wasn’t like that. If I scroll up just a little too much it will activate the scroll press in my games (which is usually ping) and it’s annoying. Other than that the mouse is pretty looking"
Dan,4,It’s a mouse,"Reviewed in the United States on July 3, 2023",Color: Classic BlackVerified Purchase,0,"Sometimes I don’t know what to believe when you see these long reviews of something simple as a mouse. However, this thing works pretty good, i’ll probably buy another of the same brand, when this one dies"
Tomas C.,4,Nice mouse,"Reviewed in the United States on July 19, 2023",Color: Classic BlackVerified Purchase,0,Great mouse. I moved away from this mouse though it often wears down faster than I expected I have bought 4 of these and they have all served me well.
Dennis,4,Deathadder,"Reviewed in the United States on August 15, 2023",Color: Mercury WhiteVerified Purchase,0,Everything was good the mouse is great for its price but i would work on the scroll wheel
Person,4,"Using with MacOS, so your experience may differ","Reviewed in the United States on May 29, 2023",Color: Mercury WhiteVerified Purchase,0,"Caveat: I have big hands and am used to using high sensitivity/DPI. I've found the mouse wasn't terrible, nor too great. It's ergonomic, looks nice, but doesn't work too great for me.

Would I recommend it for gaming? No. Would I recommend it for casual use? Maybe."
Np,4,Razor mouse,"Reviewed in the United States on August 18, 2023",Color: Classic BlackVerified Purchase,0,Good budget mouse
Cesar,4,Great mouse but be aware,"Reviewed in the United States on July 13, 2023",Color: Classic BlackVerified Purchase,0,Great mouse but be aware that it does not quite meet the description. Does not have 5 buttons or rubber side grips as listed. Still a great mouse though and still recommend as a budget option.
François,4,Wheel bounces up and down while scrolling after 4 month of normal utilization,"Reviewed in the United States on October 29, 2022",Color: Classic BlackVerified Purchase,0,"All is in the title... scrolling is extremely frustrating as the scroll wheel bounces up and downs. It started just 4 months after buying a new model. I thought Razer was a premium brand for mouse, how disappointing. First and last time i buy a razer mouse
[edit]
Well, I cried wolf too quick. I went to the razer forum and a proposed solution was to blow some air to remove dust, if any. I don't have compressed air, so I just blow some air with my mouth, and it fixed the issue. So 4 stars, the mouse is good. I just hope razer would be more cautious with dust infiltration, but after all that's a budget mouse in their catalog... can't ask too much."
Jorge Jovana,4,Decent mouse,"Reviewed in the United States on March 22, 2023",Color: Classic BlackVerified Purchase,0,"Great for the price and will probably deem reliable after long periods of use. I had to get this mouse cause my logitech had a scrolling problem so I got this and when i first got it, it was really heavy compared to my previous mouses. I'll get use to it but it's kind of like a thick yet lightweight mouse. I give it a 4.5/5"
Vladimir,4,improved on aiming instantly,"Reviewed in the United States on March 25, 2023",Color: Classic BlackVerified Purchase,0,"I used to have an old cheap mouse that wasn't bad but wasn't great either, but compared to THIS mouse it was terrible. THIS mouse is incredible, it feels so smooth and high quality. It is a little big and thick compared to what I've seen as the average mouse but still very high quality, I definitely recommend you to try it out"
Bethany Siau,4,Scroll wheel bad after <7 months of use,"Reviewed in the United States on December 29, 2022",Color: Mercury WhiteVerified Purchase,0,"Ugh. I loved this mouse. It looks and feels great. A couple of months ago the scroll wheel started to jump when I use it. It's a new mouse so it shouldn't have any issues yet, but I looked it up and I guess this is a normal problem for this mouse. I did the settings trick: control panel > mouse > wheel > one page at a time. This helped a little but it still jumps up and down. I would rather not open my mouse up to try to fix it but I think that's where I'm at :/"
Shahar Rosner,4,a bit basic but good for the price,"Reviewed in the United States on June 7, 2023",Color: Classic BlackVerified Purchase,0,"basic gaming mouse, overall does the job pretty good for the price.
feels comfortable in my hand.
a bit too light for my taste.
a bit too plasticky, there are no rubber grips as many already mentioned, only plastic."
Works Well,4,Very good,"Reviewed in the United States on June 11, 2023",Color: Classic BlackVerified Purchase,0,"The product is very good, i bought around 3 months ago and its still working very good, the only thing is that the wheel has gotten very squeaky but overall its great."
D. Turner,4,Decent mouse for everything,"Reviewed in the United States on June 12, 2023",Color: Classic BlackVerified Purchase,0,Not specifically for gaming but works well enough depending on how obsessed you are. My only real complaint is that the wheel squeaks while scrolling. That could be just mine though.
Dahlia,4,It fulfills its functionality,"Reviewed in the United States on June 29, 2023",Color: Classic BlackVerified Purchase,0,"Just like in the photo... it's a gift for my son, I hope this one lasts a little longer than the others."
Amazon Customer,4,"Good Mouse, two nitpicks","Reviewed in the United States on May 21, 2022",Color: Mercury WhiteVerified Purchase,0,"This mouse is solid, with a very sturdy build quality, unique switches, and a very nice scroll wheel. The two issues i have are that the mouse is much larger than most who haven't tried a deathadder would expect, and the clicks are semi-heavy. The weight is fine, because i don't use it for gaming anyway, the feet are smooth, the look is clean, and the shape would be nice, except for the size. For anyone who has tried a glorious model d, or roccat kone pro, or any average sized ergonomic mouse, which filled up your hand, this will be even larger. The cable is rubber, but very nice and light for a rubber cable, which makes it usable. Overall, a very solid mouse."
Sylv,4,Beautiful but need better quality control,"Reviewed in the United States on April 25, 2023",Color: Mercury WhiteVerified Purchase,0,Item was nice but I need to return it as its' right button came shaking and makes a cracking sound.. but I really like it...it's nice.
Mason,4,No changeable dpi,"Reviewed in the United States on March 21, 2023",Color: Classic BlackVerified Purchase,0,It would have been a 5 star but you can’t change the dpi and for games like valorant and csgo it’s hard to play with 6400 dpi other than that it’s a great mouse for the price
Amazon Customer,4,Great Mouse - Essential Version is arguably the best (DPI Switching is actually not very helpful),"Reviewed in the United States on December 2, 2021",Color: Mercury WhiteVerified Purchase,0,"I have been running a DeathAdder for the ergonomics for over a decade now, and picked this up to match a particular build aesthetic. I also run a black DeathAdder essential on my other computer, for broadly the same reason.

The white version is prettier, the white LED backlighting is actually quite soft and much more pleasing to the eye. The only downside is that the white version runs a cheaper non-braided cord (still white), otherwise I'd recommend the white one wholeheartedly. Honestly, if you want the aesthetic, I'd still recommend it.

Razer - Please keep making the Essentials line - I'd like to get an 'Essentials PLUS', that has the same fixed DPI (Better, IMO - can't ever mess it up, and mouse performance is great like this), but with ARGB enough to have user set fixed colors. That's all I really want/need out of a mouse."
@Setupfire6🔥,4,Good,"Reviewed in the United States on July 11, 2023",Color: Mercury WhiteVerified Purchase,0,Good
paul harrison,4,works great,"Reviewed in the United States on June 3, 2023",Color: Classic BlackVerified Purchase,0,item is as described wish it came with something to help prevent dirt getting into cracks
Aiden,4,Good but small,"Reviewed in the United States on May 3, 2023",Color: Classic BlackVerified Purchase,0,This is a pretty good mouse but does feel pretty small i would recommend a bigger size
xbadwolf,4,great product,"Reviewed in the United States on March 14, 2023",Color: Classic BlackVerified Purchase,0,"love this mouse, my go to for years, could be a bit better built and last longer though"
Pascal,4,Item not the same as the old one with same model from official website,"Reviewed in the United States on September 22, 2022",Color: Classic BlackVerified Purchase,1,"I'm not able to verify if it's new model or not authentic. Since the wire is rubber wrap not nylon(I've also attached the picture of my current mouse brought 1year ago with same model). And small details are different.
Also, they are different weights.
The Deathadder essential brought from rayzer website is 123g currently
The Deathadder essential brought from here weight is 128g.
Amazing! I wear and tear 5g of material from the old mouse after 1 year!
But hey, it's 4 stars for its current status, it's good to use."
Rockwell,4,Basic mouse,"Reviewed in the United States on March 12, 2023",Color: Classic BlackVerified Purchase,0,The buttons are very loud but it does what it needs to do.
Amazon Customer,4,Worked good for a while.,"Reviewed in the United States on October 22, 2022",Color: Classic BlackVerified Purchase,0,"Bought this about a year or so ago 2 of them for me and my S.O, worked great. The last month for some reason when I scroll (fast or slow) the scroll wheel will go down for a bit then immediately scroll back up a bit then down and up. My S.O's went at the same time, I've cleaned it and tried trouble shooting, I just assume its faulty, but still a good deal."
