user,star,sumary,country&time,kind item,image,comment
Doiv,3,Mouse wheel jitters after only 7 months!!,"Reviewed in the United States on September 20, 2023",Color: Classic BlackVerified Purchase,0,"I am SO tired of my gaming mouses getting wheel jitters. I scroll down and it'll register some of it as scrolling up, meaning if a game has keybinds with the mousewheel like Monster Hunter World, then it messes up your gaming. Also my left clicker is starting to double click and not being able to hold it so I can drag things. It's ridiculous this is happening after only 6-7 months of owning it and light gaming."
Chloe19,3,Product quality,"Reviewed in the United States on November 7, 2023",Color: Mercury WhiteVerified Purchase,0,"I had this mouse for a year when the scroll wheel quit working. I was using it normally, playing video games and it gradually started scrolling without me even touching the scroll wheel."
L. Love,3,Not Quite the Thing I Needed,"Reviewed in the United States on December 28, 2022",Color: Classic BlackVerified Purchase,0,"The good news is that the product is sleek, tracks well, and has great ergonomics. I would rate it a genuinely great buy except that the left-side, rearward (away from the cable) button does not work. Hmm, I thought maybe it needs programming, so I downloaded the app. A bit clunky, it recognized the button being pushed, but offered no way to switch its function with a working button. Clearly from the software, it is not defective, it is just unrecognized. I did some online searches only to find this is a very common problem with this mouse - button 4 does not work. The suggestions were the usual, unplug and replug - to no avail. Tried on a different machine, still not recognized.

If you do not need that particular button, treat this as a 5/5 review. If you do, there really seems to be no guarantee you can make that button work. Caveat: this is on a high-end Windows gaming PC - your mileage may vary on some other platform."
Isaiah,3,Didn't last long,"Reviewed in the United States on October 14, 2023",Color: Mercury WhiteVerified Purchase,0,"It lasted about 4-6 months for me. Has an issue with scrolling. (Scroll wheel doesn't work) also, doesn't feel like its made out of a good material. (Clunky) but for the price, maybe it's good for short-term use."
They sent wrong mouse I already have the one they sent but I'm not mad it's a good mouse,3,Wrong mouse,"Reviewed in the United States on November 14, 2023",Color: Mercury WhiteVerified Purchase,0,It's nice and clicky
Abigail Devers,3,Broke after a few months,"Reviewed in the United States on October 6, 2023",Color: Mercury WhiteVerified Purchase,0,"Ive had it for a few months now and everything works fine but the scrolling wheel. If i try to scroll, it just goes randomly up and down."
Kitten,3,Broke in 1 month,"Reviewed in the United States on May 4, 2023",Color: Classic BlackVerified Purchase,0,"The mouse was great for one month exactly, the mouse was lightweight and smooth. I really liked it, I have small hands so it was nice to have a smaller mouse. Most gaming mice are always too bulky. But it broke after 1 month of use, the scroll wheel would teleport around when I used it, at first it was annoying but then it got frustrating especially with shooters, or playing a sniper. Even worse it made me miss questions on my midterm, since scrolling would teleport me all around a page. If it didn't break, It would of been a perfect mouse, both for cost and use."
Fernando O.,3,Middle/Scroll button failure,"Reviewed in the United States on October 9, 2023",Color: Classic BlackVerified Purchase,0,"I bought 2 units, the middle/scroll button stopped working before 1 year of use in both, a shame"
David Danielson,3,"Really great mouse, but the wheels quit working after a few months. Bought another anyway...","Reviewed in the United States on October 23, 2023",Color: Classic BlackVerified Purchase,0,"Really great mouse, but the wheels quit working after a few months. Bought another anyway..."
ZB,3,Scroll wheel isn't very solid,"Reviewed in the United States on September 4, 2023",Color: Classic BlackVerified Purchase,0,"The scroll wheel doesn't feel well secured. It feels as though it isn't ratcheted. I do feel the ratchet, but barely. When I scroll, sometimes it goes the opposite direction. Not very helpful in games."
Gabrielle H,3,"Good mouse for price point, not durable","Reviewed in the United States on August 24, 2023",Color: Mercury WhiteVerified Purchase,0,"I purchased this mouse a little over a year ago, and about six months after the purchase, the scroll wheel started causing the window to scroll in the opposite direction. I was really disappointed because I love this mouse, but I won't be purchasing it again since it doesn't even last a full year."
Derek Atwood,3,"I've owned a lot of these, but not for the reason you're thinking","Reviewed in the United States on April 24, 2023",Color: Classic BlackVerified Purchase,0,"I've burned through many DeathAdders. It was my first ever gaming mouse, and I stuck with it for a while up until recently. These mice always last me only about a year before the sides start chipping off, cause they're a rubber material. The scroll wheel always ends up going haywire after a while (reverse of what you want it to do.) At one point I had a deathadder that didn't register every left click. Cool mouse but would only recommend if you plan to not use it for long."
carli,3,scroll wheel!!!!!!!!!!!,"Reviewed in the United States on August 10, 2023",Color: Mercury WhiteVerified Purchase,1,"i’ve had this mouse for almost 5 months now and a couple weeks ago the scroll wheel has stopped working properly. when i scroll up or down it scrolls the opposite way then goes to normal. it’s really annoying, but it looks good with my set up and everything else about it works really well 🥲"
Kang Chao,3,It works just okay,"Reviewed in the United States on May 3, 2023",Color: Classic BlackVerified Purchase,0,"The mouse works just okay. I wouldn't consider it as a gaming mouse. The plastic made for this mouse is very slippery and the shape of this mouse isn't a very ergonomic design. I've accidentally clicked the ""fire"" button due to the slippery material and unergonomic design. The mouse is just very hard to hold it/use it. If you need a mouse for intensive games, then my recommendation is look something else."
David Prytherch,3,"Mouse died in 3 months, no reply from Seller","Reviewed in the United States on April 18, 2023",Color: Classic BlackVerified Purchase,0,"This mouse died in 3 months -- first, the Scroll wheel became erratic, then the mouse died two weeks later. Razer will not honor the Manufacturer Warranty because the Seller (Premium Supplies Limited) is not an Authorized Reseller of Razer Products. Razer Support advised me to contact the Seller. I have sent multiple messages to the Seller, but no reply aside from the automated ""your email is very important to us..."". UPDATE: after opening a ticket with Amazon Customer Service, the Seller refunded my money in full. Thank you."
Sergio Osorio,3,Review,"Reviewed in the United States on October 25, 2023",Color: Classic BlackVerified Purchase,0,At the same time the wheel stops working properly
John & Elizabeth,3,Beware Razer's warranty policy,"Reviewed in the United States on May 1, 2023",Color: Classic BlackVerified Purchase,0,"Razer will only honor its warranty if your purchase is sold by and shipped from Amazon itself. Third party sellers void the warranty.

The mouse was great for 10 months, and then the scroll wheel started malfunctioning. It was within Razer's limited warranty period so I reached out to get it replaced. Razer claimed the warranty was voided because Amazon routed my one-click purchase through a third party seller not authorized by Razer."
Andrew,3,Scroll Wheel Broken After a Few Months,"Reviewed in the United States on March 25, 2023",Color: Classic BlackVerified Purchase,0,"Overall I loved this mouse. It feels so good ergonomically and the responsiveness is excellent. But I ordered it back in October 2022 (It is now March 2023) and I have to buy a new mouse now because the scroll wheel is going crazy on me. Every time I try to scroll one way it scrolls the other, and then it doesn't and then it does, it confuses me. So in all, great mouse for the time that it lasted which wasn't as long as I would have hoped."
Jake,3,Works but is really crappy,"Reviewed in the United States on September 18, 2023",Color: Mercury WhiteVerified Purchase,0,It works but the scroll wheel crapped out really quick. Buy something from Logitech instead.
Danilo,3,Broke after one year and warranty available since the seller is not on the Razer authorized list.,"Reviewed in the United States on August 19, 2023",Color: Classic BlackVerified Purchase,0,Razer DeathAdder Essential Gaming Mouse: 6400 DPI Optical Sensor - 5 Programmable Buttons - Mechanical Switches - Rubber Side Grips - Classic Black
Julianna t.,3,No braided cable despite picture on listing,"Reviewed in the United States on September 7, 2023",Color: Classic BlackVerified Purchase,1,"Works fine, disappointed that the cable is not braided like shown on the listings photo."
A. Holzmeist,3,"The mouse is great, but the wheel stopped working after just a few months","Reviewed in the United States on March 11, 2023",Color: Classic BlackVerified Purchase,0,"I've used to by Logitech mouses for many years, then their mouses stopped working after a year or so... sometimes it is the wheel sometimes is double clicks, no middle click, etc... I decided to give Razer a chance after many years that I had one (same issue as the logitech), and this time it lasted much less than previous times... it's sad how the mouses are lastingless and less these days..."
CJ,3,No Rubber,"Reviewed in the United States on March 22, 2023",Color: Classic BlackVerified Purchase,1,"Very lightweight, very plasticky, cheap feeling mouse. I now understand why the price was so low. Would be great for use in a kiosk-like setting. Very accurate point-and-click and will get the job done in day to day operation. No rubber to speak of as described in the product description . Will definitely upgrade."
Amazon Customer,3,"good mouse, mouse wheel issue","Reviewed in the United States on June 22, 2023",Color: Classic BlackVerified Purchase,0,"it's fine, but whenever I scroll down the mouse always tries to scroll up, leaving the mouse to go nowhere."
Matthew Graham,3,Scroll Wheel Doesn't Work Properly,"Reviewed in the United States on November 30, 2022",Color: Classic BlackVerified Purchase,0,"I like everything about this mouse except for the scroll. The problem is that I use the scroll wheel a lot. If you scroll fast the scroll has super unpredictable results. When you scroll fast down a webpage it scrolls down and then back up even though you are just scrolling down. It's frustrating enough for me to stop using this mouse. I am going to either get another mouse or use my old mouse.

I did take the mouse apart and cleaned the internal scroll mechanisms and it started working for a little bit, but it's back to being its old tricks. So I'm done with it."
AwkwardAustin,3,Excellent Mouse with Wheel Problems,"Reviewed in the United States on October 28, 2022",Color: Classic BlackVerified Purchase,0,"I'm on my third mouse.

Pros:
-Lightweight
-Good price
-Simple
-Pleasant ergonomics

Cons:
-At around 6 months, the mouse wheel will start to wear. It starts glitching out slowly at first. You'll be scrolling down in your browser and the page will jump up a bit. Then it becomes impossible to scroll.

It's like watching your pet age and begin to suffer. Except the pet's life expectancy should be a few years, instead of months.

I REALLY hope Razer can pickup the quality of this scroll wheel. It's the only mouse I'd ever use. I never eat or drink around my computer. I don't touch my mouse or keyboard with sticky fingers. I dust regularly. Just be forewarned, the scroll mechanism WILL wear out within a year."
Jason,3,Broken scroll wheel - this mouse does not meet the quality of the brand.,"Reviewed in the United States on March 27, 2023",Color: Classic BlackVerified Purchase,0,"Often, scrolling down will scroll up randomly. I noticed it whilst scrolling YouTube shorts. My old deathadder did not do this. The issue kept getting worse until its a coinflip on what a scroll up or down will actually do. Apparently this is a well-documented issue.

Update: scroll wheel died randomly. finally replacing the damned thing..."
Cameron Germano,3,You Get What You Pay For,"Reviewed in the United States on January 4, 2023",Color: Mercury WhiteVerified Purchase,0,"This mouse is a great value, but it is priced that way for a reason. It lacks the features of the more premium Razer products I have become accustomed to. There is no soft grip or felt pads. The cable is not braided. There aren't customizable LED options. But if none of those are a big concern to you, this mouse is great for the price. It isn't the most comfortable option I have used, but I wouldn't say it is uncomfortable either. For many it is a good option"
William,3,Good but has issues,"Reviewed in the United States on February 23, 2023",Color: Classic BlackVerified Purchase,0,"The mouse initially seems good. The ergonomic fit seems too ergonomic to the point it feels weird. But that is more personal preference. However the page lies about the ""rubberized side grips"" there is no rubber, it just textured plastic, the same that is on the whole mouse. Overall basic gaming mouse does what is intended but misleading informaction."
Julain,3,Good,"Reviewed in the United States on August 22, 2023",Color: Mercury WhiteVerified Purchase,0,Heavy and a little big for my hands but overall good
seamonkey10,3,Squeaky Wheel,"Reviewed in the United States on February 27, 2023",Color: Classic BlackVerified Purchase,0,"Seems like a good mouse, but the wheel squeaks like nails on a chalkboard, which leaves me with the options of taking it apart and fixing the wheel, shooting WD-40 inside, or returning it, all of which are a pain because I just want a simple mouse that works. Is there QA to make sure the wheels are greased before sending these out?"
Eugene Miller,3,Wish it had onboard memory like the old death adder mouse,"Reviewed in the United States on August 20, 2023",Color: Classic BlackVerified Purchase,0,It works. Just getting cheaper each revision.
efm,3,Mac buyers beware- Control software not compatible with MacOS...,"Reviewed in the United States on January 21, 2023",Color: Classic BlackVerified Purchase,0,"It's a fine mouse-works right out of the box on my MacBook Pro. However, the in-house mouse control software (the bells & whistles part) is not available for the Mac, and that little tidbit was not apparent on Amazon or Razer's website. Another missing piece is the interface- I have a Thunderbolt Mac. Had to buy an adapter. That would have been nice to know. Should have stuck with a known- Logitech's mouse software is available for MacOS. Alas..."
Bryan,3,It's a mouse...,"Reviewed in the United States on January 18, 2023",Color: Classic BlackVerified Purchase,0,"I got this for my office to replace my death adder elite that wasn't registering clicks anymore. Since it's for my office I'm not nit picking too hard, but I'm glad it was a cheap mouse because it's not as responsive in movements or clicks as the higher tier mice. If you're looking for a gaming mouse, spend the extra money. Also bumping down an extra star for the razer logo not lighting up like it's supposed to."
Chris,3,Very solid mouse for the price (update),"Reviewed in the United States on November 18, 2022",Color: Mercury WhiteVerified Purchase,0,"Had a corsair mouse before this and i really prefer this razor mouse even with the lack of rgb. Mouse is quick and fits well in my hand. I initially bought it since it was white but is a much better mouse overall compared to many ive tried.

had the mouse for a few months. The scroll wheel started to jump around. my brother also got the same mouse and it happened as well. Razer was nice enough to refund my money but just a buyers beware that the mouse will probably not last long."
Spinnerette,3,Ouch!,"Reviewed in the United States on April 17, 2022",Color: Classic BlackVerified Purchase,0,"I was looking for a wired mouse (usually use wireless) for better gaming. I have kind of a modified fingertip/claw grip where the base of my knuckles rest on the mouse but not my palm, and within a couple hours of using this mouse my index and middle finger knuckles became incredibly sore to the point where I had to ice my hand several times and not use a mouse at all for the rest of the day and evening. Went back to my steelseries rival 3 the next day and the pain is gone. The buttons of this mouse curve upwards at the top instead of continuing to slope downwards and the shape is quite round. 3 stars bc the product itself is fine and I'm sure it works great for others, it just doesn't work for my grip."
Jackson O,3,It is a mid mouse,"Reviewed in the United States on February 10, 2023",Color: Classic BlackVerified Purchase,0,I like this mouse but it is all plastic and has only two programmable buttons. But It is a good product for what I paid for. I would not recommend this if it is for anything other than gaming though. The mouse sensitivity is way too high for other uses. I am still happy with the purchase I made.
DW_Poltergeist,3,"Looks, Feels, &Functions Great, but no Quality.","Reviewed in the United States on October 19, 2022",Color: Classic BlackVerified Purchase,1,"I had this mouse in everyday use at work for 40-60hours a week over the course of 2.5-3mo. It functioned fine, felt great, and looked stellar at my desk, but the mouse wheel started to jitter. I looked into it and internet said clean it, so I did, still jittery, it got so bad I'm using page up and page down on the keyboard instead of the scroll wheel. Honestly expected more quality from Razer even at this price point. Maybe your experience will be better but I'm now weary about razors economy class of mouse."
Signe Dahlgren,3,"No braided cable, no rubber side grips - not as advertised","Reviewed in the United States on April 6, 2022",Color: Mercury WhiteVerified Purchase,0,"I bought this mouse to replace my previous DeathAdder Essential. This is apparently a newer, lower-quality model - they've replaced the braided cable with a rubber one. The side grips are NOT rubber, they are plastic. I've also noticed that the buttons seem much more sensitive than the older model, so I keep accidentally clicking. As with all Razer mice, expect your scroll wheel to deteriorate within a few months.

Design-wise, I love this mouse. It's so much simpler than other gaming mice, its side buttons are unobtrusive, and there's no giant DPI button in the middle. The profile and weight feel great. But it's really, really cheap. I won't be buying another one after this."
stevenn @ Socal Area,3,Average mouse.,"Reviewed in the United States on April 7, 2023",Color: Classic BlackVerified Purchase,0,"The mouse was good for over 10 days, after that the wheel is very squeaky and loudly at night. I have to return products back to Amazon."
a,3,love,"Reviewed in the United States on May 17, 2023",Color: Mercury WhiteVerified Purchase,1,giving it 3 stars bc the software pissed me off lol.. but the mouse is absolutely beautiful
Andrea Phillips,3,"Great mouse, with terrible software","Reviewed in the United States on December 19, 2022",Color: Classic BlackVerified Purchase,0,This mouse would be perfect if it didn't require you to use Razer's idiotic software to configure it. It is the most annoyingly intrusive software and I will never ever put it on my pc again. Even going through windows settings can't keep it from starting itself automatically. So no more razer mice for me.
djj,3,To much money,"Reviewed in the United States on April 4, 2023",Color: Classic BlackVerified Purchase,0,I’m not a gamer but my godson told me to buy this mouse for control.
Cain R,3,"Overall good mouse, expect scroll wheel to deteriorate within 2-5 months.","Reviewed in the United States on June 30, 2022",Color: Classic BlackVerified Purchase,0,"The deathadder had worked really well for me in the time I've been able to use it. It's great in the hand and has good drivers. The main issue I've had with it is the scroll wheel. It starts to get a bit jumpy after a month or two. Say you were to scroll down, it would scroll up and then back down. The only way I found to fix it for around 10 minutes was to blow into the scroll wheel. Great mouse for gaming, not as durable as I had hoped."
Alex,3,"Cheap and Good, extremely bad durability","Reviewed in the United States on January 12, 2023",Color: Classic BlackVerified Purchase,0,"While this mouse feels so great, the durability on this thing, especially its wheel is so bad. I had to order this exact same mouse for 4 times during 2022 because of wheel jumping."
emily,3,big,"Reviewed in the United States on March 24, 2023",Color: Mercury WhiteVerified Purchase,0,this mouse is nice and clean looking but it's very big and hard to grip if you have smaller hands
AZ Gardener,3,Buttons are too sensitive,"Reviewed in the United States on March 27, 2023",Color: Classic BlackVerified Purchase,0,I keep accidentally right clicking in factorio and deleting things. Never happened with any other mouse.
Ricardo Yalico Roncal,3,The cable is very stiff and so is the Maus,"Reviewed in the United States on February 13, 2023",Color: Classic BlackVerified Purchase,0,"I didn't like having that feeling of stiffness in the cable, I play with my laptop and it's very difficult to move more."
will,3,Gamers think twice,"Reviewed in the United States on October 17, 2022",Color: Classic BlackVerified Purchase,0,"For $20 I got a working mouse. I would never consider the mouse for any gaming. It's big, heavy, and hard to pick up to reset position on the mousepad. With this, you pay for a cheap mouse, and get a cheap mouse. This does not compete with higher priced options, but for 20 bucks it's a decent choice."
Josephine,3,"the cable ruins the whole experience, buy the v2 its way better.","Reviewed in the United States on December 22, 2022",Color: Classic BlackVerified Purchase,0,The cable got wrinkly and tangly after 4 months of use. it is absolutely horrible for gaming because of this. Everything else is great but the cable is horrible
Edward Panyalath,3,Average Gaming mouse,"Reviewed in the United States on May 3, 2022",Color: Classic BlackVerified Purchase,0,"Mouse works fine with plenty of dpi options so you can make this thing pretty fast if you want.

My main negative is that I've had it for 2 weeks and it is having scroll wheel issues already so that is a big disappointment, but other than that the mouse is decent for the cheap price."
Very Happy in Florida,3,Great mouse,"Reviewed in the United States on August 23, 2022",Color: Classic BlackVerified Purchase,0,Only reason I didn't 5 star this was because I have had this same mouse in the past. I needed another since I smashed the middle button into the last one from playing my game to much and when I got the new one everything was great but the left click sometimes gets stuck and can become annoying
Kindle Customer,3,The updated model is not as advertised,"Reviewed in the United States on April 28, 2022",Color: Classic BlackVerified Purchase,0,"While the pictures and listing show the rubber side grips and the braided cable, the mouse comes with neither. Whenever Razer updated this mouse everything went to the cheaper end. I was expecting a good value to replace a previous DeathAdder, but my expectations were not met. I'm going to return this."
heather edwards,3,Cant change color settings on MAC,"Reviewed in the United States on December 30, 2022",Color: Classic BlackVerified Purchase,0,"If you want to change the color from bright lime green... you can't if you are using this with a mac. Disappointed, will likely return"
Drew McDowell,3,Crapped out after 5 months,"Reviewed in the United States on July 8, 2022",Color: Classic BlackVerified Purchase,0,"Everything was great until I hit the 5-month mark. The mouse wheel would either quit scrolling or jump around. I attempted a cleaning, but without opening the mouse, there was limited I could do.
Kind of disappointed, Razer used to be known for quality..."
Feng Xiao,3,Scroll wheel starts to malfunction after using it for a few months,"Reviewed in the United States on September 10, 2022",Color: Classic BlackVerified Purchase,0,"Cheap, feels comfortable, but after using it for some time, the scroll wheel starts to randomly move to the opposite direction while scrolling. I bought this mouse 3 times and all of them have this scroll wheel issue."
Alan,3,very good,"Reviewed in the United States on February 20, 2023",Color: Mercury WhiteVerified Purchase,0,very good
Filiberto Cota,3,Scroll Is bad,"Reviewed in the United States on December 19, 2022",Color: Mercury WhiteVerified Purchase,0,Some times if you are scrolling fast it will jump far ahead or go backwards its really annoying
Colin Whitely,3,Wheel binds,"Reviewed in the United States on November 30, 2022",Color: Classic BlackVerified Purchase,0,"Purchased May 2022. Now it is November 2022 and I'm finding the scroll wheel binds, but is still functional."
Anon,3,NO RBG on White mouse,"Reviewed in the United States on September 23, 2022",Color: Mercury WhiteVerified Purchase,0,"There is no RBG on the white mouse- it only lights up as white, no rainbow and no adjusting the colors. Sad :'((("
