user,star,sumary,country&time,kind item,image,comment
John Schimminger,2,Not the same.,"Reviewed in the United States on October 8, 2021",Color: Classic BlackVerified Purchase,0,"I had one of these years and years ago and it was a pretty solid mouse so I decided I'd pick one up for my laptop. Times have changed. It feels dirt cheap, the left and right buttons take practically zero pressure to click and the scroll wheel is basically useless. It clicks as you are gently scrolling every single time.
I would just buy a new one but I figure as cheap as this is made its not going to last much longer anyway so I'll see it to its grave shortly. However, if I were using this to game it would be going right in the garbage because as far as I am concerned it is absolute trash for gaming.
It's sad to see how much quality has suffered since Razer has gotten bigger. I for one am done with their peripherals at least."
Joshua E Smith,2,Scroll wheel went bad. Fast.,"Reviewed in the United States on January 12, 2023",Color: Classic BlackVerified Purchase,0,"I absolutely hate to write a bad review on a product but like a bunch of other people on the page, I've got problems with the scroll wheel. I use my comp for a mix of gaming and writing, and if I can't reliably scorll my page up or down, the mouse isn't working.

Genuinely disappointed. I've always loved Razor products but this one died in less than two months after buying it. I've had this style before, so I'm very shocked."
Amazon Customer,2,Scroll Wheel Broke in a Couple Weeks,"Reviewed in the United States on June 23, 2023",Color: Mercury WhiteVerified Purchase,0,"everything else is acceptable, but the mouse wheel broke nearly as soon as I got it. annoying since it was supposed to be a replacement for another mouse with a broken mouse wheel."
Ezra,2,Poor durability,"Reviewed in the United States on August 22, 2023",Color: Classic BlackVerified Purchase,0,"Great mouse at first, but the scroll wheel stopped working after a couple months"
Cameron Pegram,2,Scroll wheel malfunctioning after only a year,"Reviewed in the United States on August 21, 2023",Color: Classic BlackVerified Purchase,0,"Not very durable, I haven't even used it very much in the past year"
Eynar Sánchez,2,It's a good product but...,"Reviewed in the United States on March 21, 2023",Color: Classic BlackVerified Purchase,0,"I bought it more than a month or two ago, it's very good, it has a pretty decent grip and the RGB is fine if you want something simple, but about 2 or 3 days ago the wheel broke down, I can't move comfortably through any interface without the wheel rising instead of going down and vice versa.
Now being the essential wheel for some games..."
Jayson Davis,2,"Have had mine for 11 days, wheel already making an annoying squeaking sound.","Reviewed in the United States on April 24, 2023",Color: Classic BlackVerified Purchase,0,"I know it is not a top of the line or expensive mouse, but for the brand name I expected a little better quality. I have been using mine for 11 days and the mouse wheel has picked up an annoying squeak already."
Jake Van Riper,2,Trackball stopped working,"Reviewed in the United States on April 8, 2023",Color: Classic BlackVerified Purchase,0,"This mouse looks cool and worked great...at first. I bought two. About 2 months in with my first, and about 6 months after buying my second, the trackball movement on both started not corresponding to actual page scrolling, which is makes the mouse nearly useless. I would not recommend this brand."
Gwen,2,Wheel lasted 3 months.,"Reviewed in the United States on June 15, 2023",Color: Classic BlackVerified Purchase,0,"Was nice at first, loved it.. then the wheel stopped working on the spin. I try to scroll up.. and it goes down.. same the other way. up/down.. back to using arrow keys."
Shaun McGrath,2,Program issues/shorter cable,"Reviewed in the United States on April 16, 2023",Color: Classic BlackVerified Purchase,0,"I was supremely disappointed with the lack of programmability within the app.
Also, the cord is INCREDIBLY short, so if you're using it with a Tower unit, be aware of that.
And because life happens, I missed the return window by a freaking day, 😆"
Konstantinos A.,2,Terrible mouse for gaming,"Reviewed in the United States on December 6, 2022",Color: Mercury WhiteVerified Purchase,0,I bought this mouse for gaming mostly moba games but using it for this type of games is terrible. mouse is too big not ergonomic at all and doesnt glide well on mouse pad (i use other gaming mouse and it works perfectly on the mouse pad). also the right click button is silent and very sensitive to touch sometimes when you play you accidentally press it and dont realize it. after two days gave the mouse away as gift to a friend of mine
Amazon Customer,2,Gr8 but breaks after 6mo,"Reviewed in the United States on June 15, 2023",Color: Classic BlackVerified Purchase,0,"I've gone through many of these at this point. When they work, they're gr8. But then they stop working and the latest one stopped working after 6 months."
Blair M.,2,Mouse Wheel Problems,"Reviewed in the United States on December 19, 2022",Color: Classic BlackVerified Purchase,0,After about 3 months the mouse wheels scroll started jumping. After 6 months the mouse wheel is unusable. Everything inside of the mouse was clean and working. I troubleshot it down to a faulty encoder (Takes the mouse wheels rotation and converts it to a digital signal). it seems many people are having encoder issues across all razer mice regardless of price point. hopefully they figure this out I'm a huge razer mouse fan.
Bike ninja,2,Great ergonomics for big hands but terrible mouse overall,"Reviewed in the United States on March 22, 2023",Color: Classic BlackVerified Purchase,0,"Lift-off height is absolutely unacceptable. If you don't know what that means, you have to lift the mouse an unreasonable amount to keep the pointer from moving when you reposition your hand. The tape trick kind of works but its a hassle and I keep having to readjust the tape. Get a different mouse."
Pacific NW,2,Wheel scroll does not work well on latest model,"Reviewed in the United States on December 21, 2022",Color: Classic BlackVerified Purchase,0,"I have been a fan of razer mice for a long time. However, their quality control is slipping.
The last one of these I bought failed in a year (previously you could expect 3 or more years).

This one has a faulty scroll wheel from the get-go.

It might be software, or it could be a flaw in construction. But from other reviews this is a
consistent complaint."
user,star,sumary,country&time,kind item,image,comment
C.,1,BEWARE OF BOOTLEGS,"Reviewed in the United States on September 26, 2023",Color: Classic BlackVerified Purchase,0,"*EDIT* The product I received was a bootleg. Looks nearly identical since it has the same body. The review remains 1 star because Amazon allows sellers to hijack popular listings by undercutting, then selling fake products. Razer is also to blame for selling their rejected mouse bodies to third parties. This review was written under the assumption that what I got was a real razer product that had gone down in quality.

THIS REVIEW IS FOR PEOPLE WHO EXPECT THE SAME QUALITY AS THEIR OLD ESSENTIAL ADDER
My old adder is (model no. : RZ01-0385) (product no. : RZ01-03850100) Made in THAILAND

on this listing it states to be (item model number : RZ01-03850100-R3U1)

what i received is (model no. : RZ01-0254) (product no. : RZ01-02540100) Made in CHINA

---

Bought one of these from game stop a couple years ago. Has worked great, and still does. But I wanted to get a new one since the scroll wheel has started to act funky after all the abuse (spamming bhops)

I noticed a few issues right away. The left and right clicks were both way stiffer than on my old one, and the right click seemed to be slightly stiffer than the left.
Second issue I noticed was that it does not glide smoothly at all. 1 glide foot is uneven making its corner dig into the mouse pad. I can literally hear it. it sounds like if you drag your finger nail on the pad. This also affects aiming.
Third issue is the thumb buttons. my old one has buttons that click like the 2 main buttons. the new one has buttons that make a hollow/cheap sound.
Fourth issue, It feels lighter. this wouldn't be a problem, but im looking for the same mouse ive grown accustomed to. I don't want to have to relearn muscle memory.

Issues 1 and 2 may fade with time as the mouse is broken in, but im not going to bother finding out. Its not the model advertised so im returning it."
Mr. Sir,1,Scroller jumps around madly after owning it for 1 year,"Reviewed in the United States on July 21, 2023",Color: Classic BlackVerified Purchase,0,"Getting customer support for the above issues is annoying as they run you through a whole checklist of things you need to do before they'll help you. After checking all those things off on the website, it promptly refuses to load Customer Support contact info. (edit: I tried again on another day and the website was fixed. The firmware still doesn't work) The firmware updater, Razer Synapse 3.0, refuses to detect this mouse and update it. Downloading the firmware from the official site and trying to apply it directly has the same result. In short, they are not supporting this product at all. Do not buy.

Edit #2 I am now approaching my third run through of customer support. It has been a literally month since I first started trying to get this mouse refunded. Every step has been littered with inconveniences seemingly designed to make the customer give up on getting a refund, and go away.

They have asked me for the same serial number three times, along with all the other info about the issue, the invoice; everything. They've also made me fill out a promise - the same promise I filled out the last two times - that I have tried a shit ton of unrelated things to make the mouse work again. Now, for the third time, after waiting weeks for a resolution, they have decided to restart the whole process and ask me from verification of my address in the form of bills, utilities, etc. I'm moving, so I can't give that. Here's the kicker - they are asking for the rest of the information too. This company is atrocious."
The wynns,1,I don't recommend,"Reviewed in the United States on February 9, 2024",Color: Classic BlackVerified Purchase,0,"Not a good mouse if you are an everyday gamer. I work from home and I game from my pc, therefore, I do use my mouse a lot. I bought it on November 10th and the scroll wheel is already skipping. I tried to find solutions online, but apparently I would have to open the mouse readjust or buy a new spring. I don't really see a way of opening this mouse, nor do I want to do that for a $25 mouse, so I'm just purchasing another one from a different brand that was recommended to me from an everyday gamer that also works from home. I do not recommend his mouse, because even though I do use my mouse a lot, it should be able to withstand use more than just 3 months."
Kev,1,"Scroll Wheel Issues, Rename to Deadhelm.","Reviewed in the United States on November 7, 2023",Color: Classic BlackVerified Purchase,0,"All joking aside, The mouse isn't particularly special, it does the job for gaming/work, it has a decent weight and shape, and the two extra programable buttons don't feel awkward or hard to press. I bought this mouse 9 months ago, (with 5 or so days extra) and the scroll wheel is already causing me issues scrolling up and down, its a heavy annoyance. It seems to be a pattern now that I'm back to see the reviews.

To be fair, I haven't found a razer mouse under $100 that lasts longer than 10 months without a scroll wheel or double/triple clicking problems. Maybe their quality sub-100 is just designed to fail before a year, but I haven't bought anything pricy enough to compare. Don't expect this mouse to last longer than a year without a miracle if you use for gaming a lot.

**NOTE**: Y'all save your money, this one in particular isn't worth it. I bought another one to confirm the longetivity just in case there might've been a defect or I treated it poorly, but the new one that arrived as of today (11/8) has a stiff scroll wheel that does not work half the time. Seriously disappointed."
Ilia,1,The scrolling wheel start bouncing and reversing. Not reliable company,"Reviewed in the United States on November 8, 2023",Color: Classic BlackVerified Purchase,0,"Bought June 3 2023, after three months of use, the wheel stopped functioning normally (when scrolling, it starts jumping down and up)

In general, I do not recommend Razer company. I previously bought headphones from them, and their software immediately did not work on my PC (I found reviews of other people with the same problem). I contacted tech support, and this was my worst experience with tech support, which seemed completely incompetent to me. They never solved my problem, although I helped them as much as possible in this matter. They simply refused to solve the problem. I returned the headphones to where I bought them.

Unfortunately, I bought the mouse from them before the headphones, and everything seemed to be fine with it until that moment. I wrote to technical support now, since the return period on Amazon has already passed. I hope I can get my money back for this poor quality mouse.

And so, in my experience, there are already two devices from Razer - both do not work as intended, plus poor technical support (which is also not easy to reach, you need to answer a lot of questions first)."
K,1,Poor quality mouse wheel,"Reviewed in the United States on October 16, 2023",Color: Mercury WhiteVerified Purchase,0,"I know its a cheaper entry level mouse, but the quality of the mouse wheel is a deal breaker. The wheel won't last long at all and will start jumping all over the place with inconsistent response. Its not even usable for web browsing, let alone gaming or anything else more productive after a few months of use. This is my experience with two of these things. If the wheel were better/lasted it'd be a great option.

Update: Setting this to a single star after attempting to deal with Razor to get support. They make it incredibly difficult. They required me to provide them proof of purchase and serial numbers 3 different times to even get a ticket going and then they go out of their way to be difficult. They actually suggested that the reason my mouse wasn't working is because the USB cord may not have been straight enough then that response will be followed by a note that they will close the ticket in 48 hours. They do everything they can to not provide you help or resolve your issue. Go with something else, anything else."
Moose Of Evil,1,"Yup, the dreaded scroll wheel skipping/bouncing issues have already shown up.","Reviewed in the United States on February 28, 2024",Color: Mercury WhiteVerified Purchase,0,"This mouse almost lived an entire three months before the dreaded scroll wheel skipping/bouncing popped up. I would ask as to why a product that was this shoddy would be allowed to be sold, but then I remember that I only paid $23 for it (It's been perpetually on sale for the last three months, can this be why?), so I'm not going to panic, I'll just simply buy someone, anyone else's mouse and go with that and pitch this in the rubbish bin.

That, or I'll give it to my mother-in-law, and gaslight her into thinking that nothing's wrong with the mouse."
Daniel W,1,Just another mouse without always logging into a Razer online account,"Reviewed in the United States on November 22, 2023",Color: Classic BlackVerified Purchase,0,"This is a nice mouse as far as quality of materials and comfort. The scroll wheel friction is a good compromise between free movement and control, though I prefer a little more spin. There is no adjustment. The buttons activate with very light pressure and have a distinctive click sound which you can hear and feel providing positive feedback. Basic decent mouse, full stop. To do all the other things that you are paying good money for you need an active online account to manage the ""cloud"" profile. So to control the lighting, set functions, program macros etc, you must be online. You can do some of this with a guest account, but they still collect your data for which Razer knows who the owner is. Synapse 3 no longer offers an ""offline"" mode that was available with version 2, and yes, this affects all Razer products."
Michael Rodrigues,1,"Worst Scroll Wheel Ever, DO NOT RECOMMEND FOR YOUR SANITY!!!","Reviewed in the United States on July 19, 2023",Color: Mercury WhiteVerified Purchase,0,"Purchased this mouse awhile back because I needed a good white mouse for my all white PC build. Worked great for a couple a months, until the problem started happening. Out of nowhere the mouse's scroll wheel started misbehaving and became jumpy. Scrolling up would randomly cause it to scroll down (and vice versa) or it would just scroll in place, refusing to scroll at all. It became incredibly frustrating to deal with. I started looking online to see if others had this issue, and it turns out it's an issue that Razer has never addressed. So I started to look at solutions on Reddit. Everyone said to just replace the mouse, but I didn't want to just incase the problem could be fixed. One person said that ""blowing really hard into the scroll wheel or using a can of compressed air could fix it."" So i tried just that. It worked for about a week and I was relieved. Then it started happening again to the point where eventually blowing into the scroll wheel only fixed it long enough for a single Call of Duty match. I finally was fed up with it and replaced the mouse soon after. WOULD NOT RECOMMEND!!!"
Santiago,1,It broke out of the blue.,"Reviewed in the United States on January 10, 2024",Color: Classic BlackVerified Purchase,0,"I bought it a year ago, however, I'm not a person who uses the computer a lot, only to check emails or write documents, so I didn't use the mouse practically for anything either. Until now that I'm going to use my computer, I realize that without having even touched it, the cursor was automatically directed to the corner and no matter how much I moved the mouse, it stayed in the corner. I disconnected it to see if I had pulled the cable or if it was a problem with the USB port and no, it was the mouse. I practically didn't use it, much less neglect it, and it got damaged anyway."
Renee,1,"Scroll wheel issue, poor customer service","Reviewed in the United States on January 28, 2024",Color: Mercury WhiteVerified Purchase,0,"After about over 1 year of using this mouse, the scroll wheel is now broken. The scroll wheel is unreliable, it will jump all over the page when scrolling through a website/document.
I've tried contacting razer support, which was a huge hassle to even start a warranty claim with them. I went back and forth with 5 different customer service agents, who asked for the same information and suggested the same troubleshooting tips. Just to be told that my mouse isn't under the 2 year warranty because this mouse isn't sold by an authorized dealer."
Steven Schronk,1,Mouse Wheel Failed In Three Months,"Reviewed in the United States on January 19, 2024",Color: Classic BlackVerified Purchase,0,"I unfortunately have two of these mice now. Both of them have a poorly designed wheel that stops working very quickly. Seems that instead of using a optical sensor for detecting the position of the wheel, a very cheap position sensor is used. The contacts for the position are very thin and have little chance to have a reasonable lifespan.

Tried to RMA the product, but the site makes it very difficult to contact them. Looked all over the site and cannot get the process started."
Tiffany,1,PLEASE READ BEFORE BUYING!!! VIRUS,"Reviewed in the United States on November 10, 2023",Color: Mercury WhiteVerified Purchase,0,"Please, for the love of god, DO NOT buy this product. There are Chinese characters on the box indicating that this is obviously not a real Razer mouse. IT IS A SCAM. Upon plugging the device, you will be prompted to download two software programs to customize and calibrate your mouse. This is where the virus happens. It PERMANENTLY disabled my Ethernet. I did not have access to my internet anymore. I uninstalled the software programs and it temporarily fixed it. It occurred again even without the software programs installed a day later. DO NOT BUY!!! Save yourself the pain of having to buy a new internet adapter or hard drive.. I can't stress this enough, just get items like these from Best Buy or the official website. The cheapness of the product will not be worth it. Please boost this and save other people from getting a virus too!"
Brittney Sosa,1,Terrible quality. Second mouse broke at 4 months of useage.,"Reviewed in the United States on August 19, 2023",Color: Mercury WhiteVerified Purchase,0,"This is the second purchase I've made of the same brand and model. I had to replace the first one after owning it for a year because when I would scroll, the page would skip upwards and downwards a bit. I took it apart, took a can of air to it to blow off any dust, and put it back together. Still having the skipping issue. I figured it was just an issue with this particular mouse and bought a new one. It hasn't been 4 months since I've owned it and I'm having the skipping issue AGAIN. To be clear, I don't live in a dusty environment or with pets. I can't figure out a discernable reason for this to continue happening. I do have another Razer mouse (it's about 6 years old) on my work computer and it is still going strong with zero issues. I suppose it's only this newer model that's having issues. Until Razer addresses and fixes this model, I highly suggest for you to use another brand."
Adwo,1,Junk,"Reviewed in the United States on March 22, 2023",Color: Classic BlackVerified Purchase,0,"I had this mouse for 2 months before it started glitching and the scroll wheel did not work. I don't know why I thought it would be different than any of the other Razor products I've owned. Razor is absolute trash marketed towards the gaming community. They look cool and have edgy names but the quality is just not there. The only reason Razor products are used by ""pro gamers"" is because they are gifted to them. Sure they might be good for a tournament but, are probably tossed out afterwards because they are unreliable for long term use and Razor will just provide new peripherals anyway. As long as they are seen using Razor products by the average Joe and e-sports fanboys.
Razor products also come with bloatware that may or may not affect the performance of your rig. This is something you don't have a choice in since factory settings are intentionally set to unplayable standards.
I have had much better success with other brands and even off-brands which cost less, last longer and perform better. Every Razor product I've ever owned hasn't lasted more that a year and has been replaced by something I am using two or more years later."
C. Diaz,1,Extremely Stiff clicks,"Reviewed in the United States on March 1, 2024",Color: Classic BlackVerified Purchase,0,"Compared to the Deathadder V2 this mouse is horrible. The clicks are extremely stiff and basically unplayable because you need to use double the force to click. The mouse feels unresponsive moving left and right, like its lagging behind. I'd rather use my Deathadder v2 with a broken rubber pad over this garbage."
Kindle Customer,1,"Less than two months after purchase, the scroll wheel has me jumping up and down the screen.","Reviewed in the United States on November 22, 2023",Color: Classic BlackVerified Purchase,0,"I previously had a logitech that had a clicker go into double clicks after 2+ yrs. I figured I'd try a different brand. This Razer Deathadder scroll wheel has gone whack. It wont scroll smoothly up and down. Its jumping back up and so on, driving me nuts.
Update 11/26
I got so fed up I did a search and found a reddit post when I typed in ""Razor mouse scroll wheel"". My first link was to a reddit post that recommend blowing into the mouse wheel area. No, not w/ canned air-it doesn't work. You have to use your breath. ...it worked. I've been using it all day and it's back to normal.
Do the search I quoted. It will at least be temp. solution."
Tyler Cooper,1,Middle Mouse Sensor Faulty,"Reviewed in the United States on March 6, 2024",Color: Classic BlackVerified Purchase,0,"Not even half a year into use and the scroll wheel sensor issue is making me replace it. Will not be purchasing from this company again.

This isn't the 80's. Blowing into a crevice of my product to make it work hasn't been acceptable since my original Nintendo."
K. Brownstein,1,Started acting up after a month,"Reviewed in the United States on March 6, 2024",Color: Mercury WhiteVerified Purchase,0,"Started off good but after a month, it started acting up. The mouse would start moving in the opposite direction of the way you wanted it to go. Became very glitchy. I had another mouse for years that never had a problem.

Wish I could return it"
RandomFemaleBuyer,1,These are FAKE,"Reviewed in the United States on February 28, 2024",Color: Mercury WhiteVerified Purchase,0,"I have used these mice forever in gaming. My scroll wheel started jumping around after 2 months. The price is way too low for this mouse and I should have known. Also, notice how the shipping is take over a month to be delivered. Coming from China."
